{
  "schema_version": "temple.parallel-plan/v1",
  "generated_at": "2026-09-23T17:07:13.035Z",
  "source_fingerprint": "06a3871594735a19c95ff25645cf679b66936ac096bf9d7021e53f3abbd9020e",
  "scope": {
    "mode": "all-active",
    "parent_work_item_id": null,
    "selected_work_item_ids": []
  },
  "max_workers": 1,
  "summary": {
    "selected": 0,
    "dispatchable": 0,
    "active": 0,
    "sequential": 0,
    "blocked": 0,
    "waves": 0
  },
  "waves": [],
  "active": [],
  "sequential": [],
  "blocked": [],
  "conflicts": [],
  "execution_policy": {
    "parallel_by_default_when_safe": true,
    "runtime_capacity_limit": 1,
    "fallback": "Execute each wave sequentially when concurrent task dispatch is unavailable.",
    "replan_after_join": true,
    "task_creation_performed": false,
    "claim_performed": false,
    "external_action_performed": false
  }
}
