{
  "schema_version": "temple.parallel-plan/v1",
  "generated_at": "2026-09-23T17:50:38.775Z",
  "source_fingerprint": "48d6cc3bea1ce92cd3290fdb0941f0f655b723eedddfc401a1a1a081cc0ab31b",
  "scope": {
    "mode": "all-active",
    "parent_work_item_id": null,
    "selected_work_item_ids": []
  },
  "max_workers": null,
  "summary": {
    "selected": 0,
    "dispatchable": 0,
    "active": 0,
    "sequential": 0,
    "blocked": 0,
    "waves": 0
  },
  "waves": [],
  "active": [],
  "sequential": [],
  "blocked": [],
  "conflicts": [],
  "execution_policy": {
    "parallel_by_default_when_safe": true,
    "runtime_capacity_limit": null,
    "fallback": "Execute each wave sequentially when concurrent task dispatch is unavailable.",
    "replan_after_join": true,
    "task_creation_performed": false,
    "claim_performed": false,
    "external_action_performed": false
  }
}
